{
  "schema_version": "0.1.0",
  "id": "eu.ec.rabies.identification-order",
  "revision": 1,
  "record_class": "official_guidance",
  "authority": "EU-EC",
  "scope": {
    "origin": "any_non_eu",
    "destination": "EU",
    "subdivisions": [],
    "species": [
      "dog",
      "cat"
    ],
    "transport_modes": [
      "cabin",
      "checked_baggage",
      "manifest_cargo",
      "road"
    ],
    "movement_category": "non_commercial_pet",
    "accompaniment": [
      "owner",
      "authorized_person"
    ],
    "travel_history_branch": "any",
    "vaccination_branch": "any",
    "exclusions": {
      "en": "Standard non-commercial entry only; tattoo, owner timing, certificate model, country overlays and other exceptions require review.",
      "zh-CN": "仅普通非商业入境；纹身、主人时间关系、证书版本、成员国叠加和其他例外待核。"
    }
  },
  "validity": {
    "effective_from": null,
    "effective_to": null,
    "applies_at": "entry_at"
  },
  "requirement": {
    "field": "events.identification_at",
    "operator": "on_or_before",
    "other_field": "events.rabies_vaccination_at"
  },
  "on_fail": "block",
  "on_missing": "needs_confirmation",
  "exceptions": [
    {
      "id": "eu.ec.exception.old-tattoo",
      "scope_note": {
        "en": "Readable tattoo applied before 3 July 2011 needs separate identification review.",
        "zh-CN": "2011年7月3日前施加且清晰可读纹身，需另核身份识别分支。"
      },
      "source_ids": [
        "eu.ec.non-eu"
      ],
      "disposition": "needs_confirmation"
    }
  ],
  "source_ids": [
    "eu.ec.non-eu"
  ],
  "evidence": [
    {
      "source_id": "eu.ec.non-eu",
      "url": "https://food.ec.europa.eu/animals/live-animal-movements/dogs-cats-and-ferrets/bringing-pet-eu-non-eu-country_en",
      "locator": "Conditions / Rabies vaccination",
      "accessed_at": "2026-10-08",
      "language": "en",
      "summary": {
        "en": "Microchip identification or reading must not follow rabies vaccination.",
        "zh-CN": "芯片识别或读取日期不得晚于狂犬病接种日期。"
      },
      "content_sha256": null
    }
  ],
  "review": {
    "status": "draft",
    "last_verified_at": null,
    "review_due_at": null,
    "reviewed_by": []
  },
  "supersedes": [],
  "message": {
    "en": "Microchip identification or reading must not follow rabies vaccination.",
    "zh-CN": "芯片识别或读取日期不得晚于狂犬病接种日期。"
  },
  "pending_checks": [
    {
      "en": "Confirm present applicability and complete the independent human review before publication.",
      "zh-CN": "发布前核实当前适用性并完成独立人工复核。"
    },
    {
      "en": "Standard non-commercial entry only; tattoo, owner timing, certificate model, country overlays and other exceptions require review.",
      "zh-CN": "仅普通非商业入境；纹身、主人时间关系、证书版本、成员国叠加和其他例外待核。"
    }
  ],
  "license": "CC-BY-4.0"
}
