{
  "schema_version": "0.1.0",
  "id": "us.cdc.cat.arrival-health",
  "revision": 1,
  "record_class": "official_guidance",
  "authority": "US-CDC",
  "scope": {
    "origin": "any",
    "destination": "US",
    "subdivisions": [],
    "species": [
      "cat"
    ],
    "transport_modes": [
      "cabin",
      "checked_baggage",
      "manifest_cargo",
      "road"
    ],
    "movement_category": "all_imports",
    "accompaniment": [
      "owner",
      "authorized_person",
      "unaccompanied"
    ],
    "travel_history_branch": "any",
    "vaccination_branch": "any",
    "exclusions": {
      "en": "CDC constraint only; USDA, destination state, territory and actual carrier remain unreviewed.",
      "zh-CN": "仅 CDC 条件；USDA、目的州、领地及承运政策未复核。"
    }
  },
  "validity": {
    "effective_from": null,
    "effective_to": null,
    "applies_at": "entry_at"
  },
  "requirement": {
    "field": "pet.appears_healthy_on_arrival",
    "operator": "equals",
    "value": true
  },
  "on_fail": "needs_confirmation",
  "on_missing": "needs_confirmation",
  "exceptions": [],
  "source_ids": [
    "us.cdc.animals"
  ],
  "evidence": [
    {
      "source_id": "us.cdc.animals",
      "url": "https://www.cdc.gov/importation/bringing-an-animal-into-the-us/index.html",
      "locator": "Cats",
      "accessed_at": "2026-10-08",
      "language": "en",
      "summary": {
        "en": "Cats must appear healthy at US arrival; inspection still applies.",
        "zh-CN": "猫入境美国时须外观健康，仍须接受检查。"
      },
      "content_sha256": null
    }
  ],
  "review": {
    "status": "draft",
    "last_verified_at": null,
    "review_due_at": null,
    "reviewed_by": []
  },
  "supersedes": [],
  "message": {
    "en": "Cats must appear healthy at US arrival; inspection still applies.",
    "zh-CN": "猫入境美国时须外观健康，仍须接受检查。"
  },
  "pending_checks": [
    {
      "en": "Confirm present applicability and complete the independent human review before publication.",
      "zh-CN": "发布前核实当前适用性并完成独立人工复核。"
    },
    {
      "en": "CDC constraint only; USDA, destination state, territory and actual carrier remain unreviewed.",
      "zh-CN": "仅 CDC 条件；USDA、目的州、领地及承运政策未复核。"
    }
  ],
  "license": "CC-BY-4.0"
}
