{
  "schema_version": "0.1.0",
  "id": "us.as.cargo.health-certificate",
  "revision": 1,
  "record_class": "carrier_policy",
  "authority": "US-AS-Cargo",
  "scope": {
    "origin": "US",
    "destination": "US",
    "subdivisions": [],
    "species": [
      "dog",
      "cat"
    ],
    "transport_modes": [
      "manifest_cargo"
    ],
    "movement_category": "domestic_pet",
    "accompaniment": [
      "owner",
      "authorized_person",
      "unaccompanied"
    ],
    "travel_history_branch": "any",
    "vaccination_branch": "any",
    "exclusions": {
      "en": "Not a complete legal/carrier package; no acceptance or booking evidence.",
      "zh-CN": "非完整法规／承运包；无收运或订舱证据。"
    }
  },
  "validity": {
    "effective_from": null,
    "effective_to": null,
    "applies_at": "entry_at"
  },
  "requirement": {
    "field": "documents.health_certificate_present",
    "operator": "equals",
    "value": true
  },
  "on_fail": "needs_confirmation",
  "on_missing": "needs_confirmation",
  "exceptions": [],
  "source_ids": [
    "us.as.cargo-petconnect"
  ],
  "evidence": [
    {
      "source_id": "us.as.cargo-petconnect",
      "url": "https://www.alaskacargo.com/petconnect",
      "locator": "Certificate Requirements / Health Certificate",
      "accessed_at": "2026-10-08",
      "language": "en",
      "summary": {
        "en": "Cargo requires a health certificate; presence alone does not validate its examination date or content.",
        "zh-CN": "货运要求健康证；存在证书不证明检查日期及内容合格。"
      },
      "content_sha256": null
    }
  ],
  "review": {
    "status": "draft",
    "last_verified_at": null,
    "review_due_at": null,
    "reviewed_by": []
  },
  "supersedes": [],
  "message": {
    "en": "Cargo requires a health certificate; presence alone does not validate its examination date or content.",
    "zh-CN": "货运要求健康证；存在证书不证明检查日期及内容合格。"
  },
  "pending_checks": [
    {
      "en": "Partial draft only. Full scope, dates, exceptions, local and emergency requirements need independent review.",
      "zh-CN": "仅部分草稿；完整范围、日期、例外、地方及应急要求须独立复核。"
    }
  ],
  "license": "CC-BY-4.0"
}
